{"schema":"oreflow.manifest/v2","case_id":"phosphate_clay","category":"classification","family":"deslime_rougher","title":{"en":"Phosphate with clay slimes","es":"Fosfato con lamas arcillosas"},"engine_version":"0.10.002","contract_digest":"0d2b65d272f3abcc6adffbf0f734c985cb002ab5cb665c109b8e8e9e31cecbd7","artifact":{"path":"cases/phosphate_clay.json","bytes":610017,"sha256":"e9e590bbca630f2ab2c432255a514d9f938ea535ef64e35755ecbec32e45e0e2","schema":"oreflow.case/v2"},"variants":["nominal","harder_ore","coarser_grind","higher_throughput","coarser_deslime","more_collector","cut_nominal","cut_finer"],"nominal":{"recovery_pct":73.37692824854557,"concentrate_grade":34.93299447875049,"specific_energy_total_kwh_t":7.537080734230825,"p80_um":149.99999999999997,"mill_power_kw":3237.9144879635633},"kpis":{"recovery_pct":{"value":73.37692824854557,"range":[50.0,82.0],"within":true},"concentrate_grade":{"value":34.93299447875049,"range":[32.0,38.0],"within":true},"flotation_recovery_pct":{"value":92.53609090769322,"range":[78.0,95.0],"within":true},"slimes_loss_pct":{"value":20.704529952815275,"range":[5.0,25.0],"within":true}}}