{"schema":"oreflow.manifest/v2","case_id":"zinc_sulfide","category":"flotation","family":"rougher","title":{"en":"Zinc sulphide","es":"Sulfuro de zinc"},"engine_version":"0.10.006","contract_digest":"0d2b65d272f3abcc6adffbf0f734c985cb002ab5cb665c109b8e8e9e31cecbd7","artifact":{"path":"cases/zinc_sulfide.json","bytes":618181,"sha256":"bf8f385eba7c4003da0f1e50d87f19ad909b823ee11630014d94657bb4f7e251","schema":"oreflow.case/v2"},"variants":["nominal","harder_ore","coarser_grind","higher_throughput","more_collector","more_air","cut_nominal","cut_finer"],"nominal":{"recovery_pct":88.45812261594861,"concentrate_grade":49.580715248483905,"specific_energy_total_kwh_t":16.13001324054935,"p80_um":106.00000000000036,"mill_power_kw":11730.273049931056},"kpis":{"recovery_pct":{"value":88.45812261594861,"range":[82.0,93.0],"within":true},"concentrate_grade":{"value":49.580715248483905,"range":[45.0,60.0],"within":true}}}