{"schema":"oreflow.manifest/v2","case_id":"copper_porphyry_hard","category":"liberation","family":"rougher","title":{"en":"Hard copper porphyry","es":"Pórfido de cobre duro"},"engine_version":"0.10.003","contract_digest":"0d2b65d272f3abcc6adffbf0f734c985cb002ab5cb665c109b8e8e9e31cecbd7","artifact":{"path":"cases/copper_porphyry_hard.json","bytes":670568,"sha256":"c8fdde89574c7a28d2da9ddfbe794e633b4764d2182c95f8ab3db03d2b85f140","schema":"oreflow.case/v2"},"variants":["nominal","harder_ore","coarser_grind","higher_throughput","more_collector","more_air","cut_nominal","cut_finer"],"nominal":{"recovery_pct":93.27399826596478,"concentrate_grade":26.169356623036133,"specific_energy_total_kwh_t":16.128598092408794,"p80_um":165.00000000000082,"mill_power_kw":7239.203672413863},"kpis":{"recovery_pct":{"value":93.27399826596478,"range":[90.0,96.0],"within":true},"concentrate_grade":{"value":26.169356623036133,"range":[25.0,34.6],"within":true}}}