{"schema":"oreflow.manifest/v2","case_id":"mixed_ore_high_clay","category":"integration","family":"deslime_rougher","title":{"en":"Copper ore with clay","es":"Mineral de cobre con arcilla"},"engine_version":"0.10.006","contract_digest":"0d2b65d272f3abcc6adffbf0f734c985cb002ab5cb665c109b8e8e9e31cecbd7","artifact":{"path":"cases/mixed_ore_high_clay.json","bytes":687409,"sha256":"60755b486f6b2f608fee325a5576a79ba277d37268f6885abd920eab61b1661f","schema":"oreflow.case/v2"},"variants":["nominal","harder_ore","coarser_grind","higher_throughput","coarser_deslime","more_collector","cut_nominal","cut_finer"],"nominal":{"recovery_pct":80.02529212645244,"concentrate_grade":22.82766037539502,"specific_energy_total_kwh_t":12.238693840876174,"p80_um":150.00000000000037,"mill_power_kw":5231.900953443382},"kpis":{"recovery_pct":{"value":80.02529212645244,"range":[72.0,90.0],"within":true},"concentrate_grade":{"value":22.82766037539502,"range":[18.0,30.0],"within":true}}}