{"schema":"oreflow.manifest/v2","case_id":"gold_free_milling","category":"classification","family":"gravity_rougher","title":{"en":"Free-milling gold with gravity","es":"Oro de molienda libre con gravimetría"},"engine_version":"0.10.002","contract_digest":"0d2b65d272f3abcc6adffbf0f734c985cb002ab5cb665c109b8e8e9e31cecbd7","artifact":{"path":"cases/gold_free_milling.json","bytes":577976,"sha256":"e40a6fa77f80b3b2fe19d6e94422b6e49901eb59bac8f845e3f18ed5124f59cc","schema":"oreflow.case/v2"},"variants":["nominal","harder_ore","coarser_grind","higher_throughput","larger_bleed","more_collector","cut_nominal","cut_finer"],"nominal":{"recovery_pct":97.4966323815073,"concentrate_grade":92.58845823689734,"specific_energy_total_kwh_t":16.77421504781066,"p80_um":106.00000000000017,"mill_power_kw":4059.8514188855897},"kpis":{"recovery_pct":{"value":97.4966323815073,"range":[85.0,98.0],"within":true},"gravity_recovery_pct":{"value":27.015115357876684,"range":[15.0,30.0],"within":true}}}