{"schema":"oreflow.manifest/v2","case_id":"iron_magnetite_fine","category":"liberation","family":"magnetic","title":{"en":"Fine magnetite concentration","es":"Concentración de magnetita fina"},"engine_version":"0.10.003","contract_digest":"0d2b65d272f3abcc6adffbf0f734c985cb002ab5cb665c109b8e8e9e31cecbd7","artifact":{"path":"cases/iron_magnetite_fine.json","bytes":423024,"sha256":"cf9bdc1106d34911f1eb0d83c30f12aee0c11d9562f4dff9a5b2e1e8fdf684a1","schema":"oreflow.case/v2"},"variants":["nominal","harder_ore","coarser_grind","finer_grind","higher_throughput","finer_crusher","cut_nominal","cut_finer"],"nominal":{"recovery_pct":84.95153797330254,"concentrate_grade":65.71665222033538,"specific_energy_total_kwh_t":20.166955508941857,"p80_um":60.000000000001265,"mill_power_kw":17612.437655387996},"kpis":{"recovery_pct":{"value":84.95153797330254,"range":[70.0,92.0],"within":true},"concentrate_grade":{"value":65.71665222033538,"range":[64.9,69.0],"within":true},"magnetite_recovery_pct":{"value":94.37633938337636,"range":[90.0,99.5],"within":true}}}