{"schema":"oreflow.manifest/v2","case_id":"nickel_sulphide","category":"classification","family":"deslime_rougher","title":{"en":"Nickel sulphide with serpentine slimes","es":"Sulfuro de níquel con lamas de serpentina"},"engine_version":"0.10.003","contract_digest":"0d2b65d272f3abcc6adffbf0f734c985cb002ab5cb665c109b8e8e9e31cecbd7","artifact":{"path":"cases/nickel_sulphide.json","bytes":627135,"sha256":"e7017d5e3d64a973668f83f683b8dae6ed44d6bae41753e26be7254212670c1b","schema":"oreflow.case/v2"},"variants":["nominal","harder_ore","coarser_grind","higher_throughput","coarser_deslime","more_collector","cut_nominal","cut_finer"],"nominal":{"recovery_pct":76.29677762074117,"concentrate_grade":18.86366229657331,"specific_energy_total_kwh_t":15.781365098020206,"p80_um":105.99999999999997,"mill_power_kw":5820.909151753109},"kpis":{"recovery_pct":{"value":76.29677762074117,"range":[65.0,88.0],"within":true},"concentrate_grade":{"value":18.86366229657331,"range":[18.0,22.0],"within":true},"concentrate_MgO":{"value":6.760779748071628,"range":[4.0,12.0],"within":true}}}