{"schema":"oreflow.manifest/v2","case_id":"refractory_gold","category":"integration","family":"rougher","title":{"en":"Refractory gold in sulphides","es":"Oro refractario en sulfuros"},"engine_version":"0.10.000","contract_digest":"0d2b65d272f3abcc6adffbf0f734c985cb002ab5cb665c109b8e8e9e31cecbd7","artifact":{"path":"cases/refractory_gold.json","bytes":587840,"sha256":"7dab13e57ff81c3d6a975fb92917c196ee84c2366eba73319a82ef0f1a7fc19b","schema":"oreflow.case/v2"},"variants":["nominal","harder_ore","coarser_grind","higher_throughput","more_collector","more_air","cut_nominal","cut_finer"],"nominal":{"recovery_pct":92.51559498057222,"concentrate_grade":28.125377061712186,"specific_energy_total_kwh_t":19.288738901332753,"p80_um":105.99999999999989,"mill_power_kw":5567.239440528458},"kpis":{"recovery_pct":{"value":92.51559498057222,"range":[80.0,95.0],"within":true},"concentrate_grade":{"value":28.125377061712186,"range":[12.0,38.6],"within":true}}}