{"schema":"oreflow.manifest/v2","case_id":"low_grade_copper","category":"integration","family":"rougher","title":{"en":"Low-grade copper at high throughput","es":"Cobre de baja ley a alto tratamiento"},"engine_version":"0.10.002","contract_digest":"0d2b65d272f3abcc6adffbf0f734c985cb002ab5cb665c109b8e8e9e31cecbd7","artifact":{"path":"cases/low_grade_copper.json","bytes":669206,"sha256":"e57200cfe148127f5bbc4c67fa050324625b00874535424761ef3dfcada2795d","schema":"oreflow.case/v2"},"variants":["nominal","harder_ore","coarser_grind","higher_throughput","more_collector","more_air","cut_nominal","cut_finer"],"nominal":{"recovery_pct":91.00540670339586,"concentrate_grade":25.81575534797718,"specific_energy_total_kwh_t":12.852398140830648,"p80_um":180.0,"mill_power_kw":12602.0216179128},"kpis":{"recovery_pct":{"value":91.00540670339586,"range":[90.0,96.0],"within":true},"concentrate_grade":{"value":25.81575534797718,"range":[25.0,34.6],"within":true}}}