{"schema":"oreflow.manifest/v2","case_id":"copper_molybdenum","category":"flotation","family":"rougher","title":{"en":"Copper-molybdenum bulk flotation","es":"Flotación colectiva cobre-molibdeno"},"engine_version":"0.10.001","contract_digest":"0d2b65d272f3abcc6adffbf0f734c985cb002ab5cb665c109b8e8e9e31cecbd7","artifact":{"path":"cases/copper_molybdenum.json","bytes":664661,"sha256":"833367a2a3cc62c5a694d98172b19c1f4282cbe2236e050705098f81c3393038","schema":"oreflow.case/v2"},"variants":["nominal","harder_ore","coarser_grind","higher_throughput","more_collector","more_air","cut_nominal","cut_finer"],"nominal":{"recovery_pct":93.44658144023319,"concentrate_grade":26.577742746862327,"specific_energy_total_kwh_t":14.990229817233006,"p80_um":149.99999999999997,"mill_power_kw":8449.79713787854},"kpis":{"recovery_pct":{"value":93.44658144023319,"range":[90.0,96.0],"within":true},"concentrate_grade":{"value":26.577742746862327,"range":[25.0,34.6],"within":true},"recovery_Mo_pct":{"value":82.9807010891023,"range":[82.0,92.0],"within":true}}}