{"schema":"oreflow.manifest/v2","case_id":"copper_porphyry_soft","category":"liberation","family":"rougher","title":{"en":"Soft copper porphyry","es":"Pórfido de cobre blando"},"engine_version":"0.10.007","contract_digest":"0d2b65d272f3abcc6adffbf0f734c985cb002ab5cb665c109b8e8e9e31cecbd7","artifact":{"path":"cases/copper_porphyry_soft.json","bytes":611886,"sha256":"30276390310ac5b75bc505a8a7d47a936bbc16ee4389679e97af12673f958f4e","schema":"oreflow.case/v2"},"variants":["nominal","harder_ore","coarser_grind","higher_throughput","more_collector","more_air","cut_nominal","cut_finer"],"nominal":{"recovery_pct":92.21261928007924,"concentrate_grade":26.415673447496314,"specific_energy_total_kwh_t":10.394628844259875,"p80_um":149.99999999999997,"mill_power_kw":6456.494528849473},"kpis":{"recovery_pct":{"value":92.21261928007924,"range":[90.0,96.0],"within":true},"concentrate_grade":{"value":26.415673447496314,"range":[25.0,34.6],"within":true}}}