{"schema":"oreflow.manifest/v2","case_id":"copper_oxide","category":"flotation","family":"rougher","title":{"en":"Oxide copper: assumed sulphidized response","es":"Cobre oxidado: respuesta sulfidizada supuesta"},"engine_version":"0.10.007","contract_digest":"0d2b65d272f3abcc6adffbf0f734c985cb002ab5cb665c109b8e8e9e31cecbd7","artifact":{"path":"cases/copper_oxide.json","bytes":643174,"sha256":"15075074035eeaaf195ac1b6fadd364ba910894c012802c6465e4f2537f690e1","schema":"oreflow.case/v2"},"variants":["nominal","harder_ore","coarser_grind","higher_throughput","more_collector","more_air","cut_nominal","cut_finer"],"nominal":{"recovery_pct":76.53926810619504,"concentrate_grade":9.120282769642959,"specific_energy_total_kwh_t":11.262785567232166,"p80_um":139.9999999999803,"mill_power_kw":5998.40882736237},"kpis":{"recovery_pct":{"value":76.53926810619504,"range":[65.0,86.0],"within":true},"concentrate_grade":{"value":9.120282769642959,"range":[5.0,18.0],"within":true}}}